Session ID,session_1747372537989_buk8wm5
Prolific ID,677fb35eafd357a07e351a9f
Status,completed
Progress,29/29
Created At,"5/16/2025, 1:15:37 AM"
Updated At,"5/16/2025, 1:42:47 AM"
Completed At,"5/16/2025, 1:42:47 AM"

Question Number,Question,Answer
1,To what extent do you support or oppose the widespread deployment of surveillance cameras in public spaces? Please explain your reasoning.,i oppose widespread surveillance because of the opportunity for government harm people
2,"What do you think are the most significant impacts, positive or negative, of increasing surveillance camera coverage in urban areas?",marginalized groups may be harmed
3,How do you think surveillance technologies might affect public safety and crime rates?,"crime rates may decrease and public safety may increase, or, governments may misuse surveillance for their own purposes to exploit and harm certain groups"
4,What impact do you believe increased surveillance might have on personal privacy and individual liberties?,personal privacy and individual liberties will decrease
5,How do you think surveillance camera systems might affect community trust and police-community relations?,I think it will decrease
6,What role do you believe government should play in regulating surveillance technologies and data collection?,government should regulate surveillance technologies and data collection
7,How might technological concerns about accuracy and reliability factor into decisions about surveillance systems?,accuracy and reliability should be a concern and should be proven accurate before decisions are approved
8,"What economic effects, both positive and negative, might result from investing in widespread surveillance infrastructure?",if crime decrease people may feel more secure to spend more money at local shops
9,How do you think the interests of law enforcement versus privacy advocates should be balanced when making surveillance policy?,law enforcement should do their best without invading the privacy of all citizens
10,What role do you think social equity and potential bias play in discussions about surveillance technologies?,surveillance AI systems should be trained to not be biased
11,"Would small changes in Government abuse lead to noticeable changes in Support for surveillance camera, or would it take larger shifts? Does it have a positive effect (increasing it) or a negative effect (decreasing it)? How strong is this effect?",it would take larger changes in government abuse to lead to noticeable changes for support
12,What causes changes in Support for surveillance camera? Are these influences strong or weak?,it would take more trust in government which comes from a proven track record on not committing abuses
13,"Does Marginalized groups have a positive or negative effect on Support for surveillance camera, and how significant is this effect? Does it have a positive effect (increasing it) or a negative effect (decreasing it)? How strong is this effect?",marginalized groups have a moderate negative effect
14,How would you describe the relationship between Increase in public safety and Support for surveillance camera? Is it a strong or weak connection? Does it have a positive effect (increasing it) or a negative effect (decreasing it)? How strong is this effect?,it has a strong positive effect
15,How would you describe the relationship between Personal privacy and Support for surveillance camera? Is it a strong or weak connection? Does it have a positive effect (increasing it) or a negative effect (decreasing it)? How strong is this effect?,it has a strong negative effect
16,"Does Individual liberties have a positive or negative effect on Support for surveillance camera, and how significant is this effect? Does it have a positive effect (increasing it) or a negative effect (decreasing it)? How strong is this effect?",a strong negative effect
17,How confident are you that changes in Decrease in community trust lead to changes in Support for surveillance camera? Does it have a positive effect (increasing it) or a negative effect (decreasing it)? How strong is this effect?,decreasing community trust leads to strong decrease in support for surveillance camera
18,"Does Surveillance technologies have a positive or negative effect on Support for surveillance camera, and how significant is this effect? Does it have a positive effect (increasing it) or a negative effect (decreasing it)? How strong is this effect?",a small positive effect
19,How confident are you that changes in Reliability lead to changes in Support for surveillance camera? Does it have a positive effect (increasing it) or a negative effect (decreasing it)? How strong is this effect?,fairly confident it has a moderate positive effect
20,How confident are you that changes in Proven accuracy lead to changes in Support for surveillance camera? Does it have a positive effect (increasing it) or a negative effect (decreasing it)? How strong is this effect?,I am confident that it leads to moderate positive effect
21,"Would small changes in Economic security lead to noticeable changes in Support for surveillance camera, or would it take larger shifts? Does it have a positive effect (increasing it) or a negative effect (decreasing it)? How strong is this effect?",no change neither positive or negative
22,"Does surveillance policies have a positive or negative effect on Support for surveillance camera, and how significant is this effect? Does it have a positive effect (increasing it) or a negative effect (decreasing it)? How strong is this effect?",they have a moderate negative effect
23,How confident are you that changes in Unbiased AI Systems lead to changes in Support for surveillance camera? Does it have a positive effect (increasing it) or a negative effect (decreasing it)? How strong is this effect?,confident they have a moderate positive effect
24,How confident are you that changes in Support for surveillance cameras lead to changes in Support for surveillance camera? Does it have a positive effect (increasing it) or a negative effect (decreasing it)? How strong is this effect?,perhaps a mild positive effect
25,"Would small changes in Trust in government lead to noticeable changes in Support for surveillance camera, or would it take larger shifts? Does it have a positive effect (increasing it) or a negative effect (decreasing it)? How strong is this effect?","no , it would take larger shifts to have a positive effect"
26,"What do you think are the main causes of Surveillance cameras, and how certain are you about these relationships? Please also indicate if these influences are positive (increasing) or negative (decreasing).",I am certain
27,"What might lead to increases or decreases in Decrease in crime rates, and how significant are these effects? Please also indicate if these influences are positive (increasing) or negative (decreasing).",hello
28,"What factors do you think influence Individual liberties, and how strong is their impact? Please also indicate if these influences are positive (increasing) or negative (decreasing).",sometimes it is neccessary
29,What causes changes in Increased surveillance? Are these influences strong or weak?,the need for less criminal behavior has a moderate influence