Session ID,session_1747324276241_0mc54ha
Prolific ID,67ad193553c9041650416662
Status,completed
Progress,27/27
Created At,"5/15/2025, 11:51:16 AM"
Updated At,"5/15/2025, 12:06:28 PM"
Completed At,"5/15/2025, 12:06:28 PM"

Question Number,Question,Answer
1,To what extent do you support or oppose universal healthcare policies that provide government-funded healthcare coverage for all citizens? Please explain your reasoning.,"I support universal healthcare because it gives everyone access to medical care, no matter their income. It improves health and makes the system fairer."
2,"What do you think are the most significant impacts, positive or negative, of implementing a universal healthcare system?","Universal healthcare helps everyone get care and lowers costs, but it can be expensive and may cause longer wait times."
3,How do you think universal healthcare policies might affect healthcare quality and accessibility?,Universal healthcare usually improves access to care for everyone. Quality can improve with better prevention but might drop if resources are stretched thin.
4,What impact do you believe a universal healthcare system might have on medical innovation and research?,Universal healthcare might slow some medical innovation due to lower profits but can also boost research by providing more patient data and funding. The impact is mixed.
5,How do you think universal healthcare might affect the economic burden on individuals and families?,Universal healthcare lowers the economic burden by reducing medical bills and making healthcare more affordable for individuals and families.
6,What role do you believe government should play in healthcare delivery and financing?,The government should ensure everyone has access to healthcare by funding and regulating the system to keep it fair and affordable.
7,How might healthcare provider concerns factor into decisions about universal healthcare implementation?,"Healthcare providers’ concerns, like pay, workload, and quality of care, should be considered to ensure they support and effectively deliver universal healthcare."
8,"What economic effects, both positive and negative, might result from transitioning to a universal healthcare system?",Positive effects include lower costs for families and better public health. Negative effects may be higher taxes and government spending.
9,How do you think the interests of taxpayers versus healthcare consumers should be balanced when making healthcare policy?,Policies should balance taxpayers’ need for affordable costs with consumers’ need for quality care and access. Both groups’ interests matter.
10,What role do you think social equity and access to care play in discussions about healthcare policy?,Social equity and access to care have a positive effect on healthcare policy because they ensure fairness and better health outcomes for all.
11,How confident are you that changes in Access to medical care lead to changes in Support for universal healthcare? Does it have a positive effect (increasing it) or a negative effect (decreasing it)? How strong is this effect?,I am very confident that better access to medical care increases support for universal healthcare. This effect is positive and strong.
12,"What factors do you think influence Support for universal healthcare, and how strong is their impact? Please also indicate if these influences are positive (increasing) or negative (decreasing).","Key factors that increase support for universal healthcare are better access to care (strong positive), concern for social equity (strong positive), and lower personal medical costs (medium positive). Factors that decrease support include fears of higher taxes (medium negative) and concerns about government control or wait times (medium negative)."
13,"Does Improvement in access to care have a positive or negative effect on Support for universal healthcare, and how significant is this effect? Does it have a positive effect (increasing it) or a negative effect (decreasing it)? How strong is this effect?",Improvement in access to care has a strong positive effect on support for universal healthcare. It increases support significantly.
14,How confident are you that changes in Mixed impact lead to changes in Support for universal healthcare? Does it have a positive effect (increasing it) or a negative effect (decreasing it)? How strong is this effect?,I am somewhat confident that mixed impacts lead to changes in support for universal healthcare. The effect can be both positive or negative but is usually moderate in strength.
15,How confident are you that changes in Economic burden lead to changes in Support for universal healthcare? Does it have a positive effect (increasing it) or a negative effect (decreasing it)? How strong is this effect?,"I am very confident that changes in economic burden affect support for universal healthcare. When the burden decreases, support increases. This effect is positive and strong."
16,"Is the effect of Fairness in healthcare system on Support for universal healthcare immediate, or does it take time to develop? Does it have a positive effect (increasing it) or a negative effect (decreasing it)? How strong is this effect?",The effect of fairness in the healthcare system on support for universal healthcare usually takes time to develop. It has a positive effect and is moderately strong.
17,"Would small changes in Affordability of healthcare lead to noticeable changes in Support for universal healthcare, or would it take larger shifts? Does it have a positive effect (increasing it) or a negative effect (decreasing it)? How strong is this effect?",Small changes in healthcare affordability can lead to noticeable increases in support for universal healthcare. This effect is positive and strong.
18,"Is the effect of Universal healthcare access on Support for universal healthcare immediate, or does it take time to develop? Does it have a positive effect (increasing it) or a negative effect (decreasing it)? How strong is this effect?",The effect of universal healthcare access on support usually takes time to develop. It has a strong positive effect.
19,How would you describe the relationship between universal healthcare implementation and Support for universal healthcare? Is it a strong or weak connection? Does it have a positive effect (increasing it) or a negative effect (decreasing it)? How strong is this effect?,The relationship between universal healthcare implementation and support is strong and positive. Implementation increases support significantly.
20,"Is the effect of Better public health on Support for universal healthcare immediate, or does it take time to develop? Does it have a positive effect (increasing it) or a negative effect (decreasing it)? How strong is this effect?",The effect of better public health on support for universal healthcare takes time to develop. It has a strong positive effect.
21,"Is the effect of Affordable costs on Support for universal healthcare immediate, or does it take time to develop? Does it have a positive effect (increasing it) or a negative effect (decreasing it)? How strong is this effect?",The effect of affordable costs on support for universal healthcare is mostly immediate. It has a strong positive effect.
22,"Does Importance of both groups' needs have a positive or negative effect on Support for universal healthcare, and how significant is this effect? Does it have a positive effect (increasing it) or a negative effect (decreasing it)? How strong is this effect?",The importance of balancing both groups’ needs has a positive effect on support for universal healthcare. This effect is moderately strong.
23,"Does Positive effect have a positive or negative effect on Support for universal healthcare, and how significant is this effect? Does it have a positive effect (increasing it) or a negative effect (decreasing it)? How strong is this effect?",Positive effects have a strong positive impact on support for universal healthcare. They significantly increase support.
24,What causes changes in Universal healthcare? Are these influences strong or weak?,"Changes in universal healthcare are caused by factors like government policy, public opinion, healthcare costs, and access to services. These influences are usually strong."
25,How confident are you that changes in Strength of effect lead to changes in Support for universal healthcare? Does it have a positive effect (increasing it) or a negative effect (decreasing it)? How strong is this effect?,"I am very confident that changes in the strength of effect lead to changes in support for universal healthcare. It has a positive and strong effect, increasing support."
26,How would you describe the relationship between Strong positive relationship and Support for universal healthcare? Is it a strong or weak connection? Does it have a positive effect (increasing it) or a negative effect (decreasing it)? How strong is this effect?,There is a strong positive relationship with support for universal healthcare. This connection is strong and increases support significantly.
27,"What do you think are the main causes of Lower profits, and how certain are you about these relationships? Please also indicate if these influences are positive (increasing) or negative (decreasing).",The main causes of lower profits are higher government spending and price controls in universal healthcare. These causes have a strong negative effect on profits. I am fairly certain about these relationships.