Session ID,session_1747330428107_hvmkpf8
Prolific ID,5d92ac10a45dbf0019d5e7fd
Status,completed
Progress,23/23
Created At,"5/15/2025, 1:33:48 PM"
Updated At,"5/15/2025, 1:54:25 PM"
Completed At,"5/15/2025, 1:54:25 PM"

Question Number,Question,Answer
1,To what extent do you support or oppose universal healthcare policies that provide government-funded healthcare coverage for all citizens? Please explain your reasoning.,I support it as we are one of the only first would countries without access to universal health care. Other countries are able to do it successfully and with minimal downsides.
2,"What do you think are the most significant impacts, positive or negative, of implementing a universal healthcare system?",Positive as there will be less people dying due to lack of access of care.
3,How do you think universal healthcare policies might affect healthcare quality and accessibility?,Accessibility will be better as it will allow even homeless people to receive the care they need
4,What impact do you believe a universal healthcare system might have on medical innovation and research?,None
5,How do you think universal healthcare might affect the economic burden on individuals and families?,I don't think it will affect us financially. The government can shift money around to cover it
6,What role do you believe government should play in healthcare delivery and financing?,None.
7,How might healthcare provider concerns factor into decisions about universal healthcare implementation?,I think that those with concerns can go the private practice way if they are concerned about pay or implementation
8,"What economic effects, both positive and negative, might result from transitioning to a universal healthcare system?",The positive effect is that there would be more money in the health sector.
9,How do you think the interests of taxpayers versus healthcare consumers should be balanced when making healthcare policy?,"If it will not affect taxpayers, their interest should not be considered. We must do what is best for the general population."
10,What role do you think social equity and access to care play in discussions about healthcare policy?,I think it plays a minor roll as people are more concerned about the potential costs and changes to care.
11,"Does Universal healthcare have a positive or negative effect on Support for universal healthcare, and how significant is this effect? Does it have a positive effect (increasing it) or a negative effect (decreasing it)? How strong is this effect?","At this time it was a negative effect as people think that universal healthcare will cost a lot, limit providers, cause longer lines, etc."
12,How confident are you that changes in Access to healthcare lead to changes in Support for universal healthcare? Does it have a positive effect (increasing it) or a negative effect (decreasing it)? How strong is this effect?,I do not know as there are too many factors that could play into it
13,"Does Access to care have a positive or negative effect on Support for universal healthcare, and how significant is this effect? Does it have a positive effect (increasing it) or a negative effect (decreasing it)? How strong is this effect?",Negative effect as people with access to care do not think about those who cannot afford it so they want the status quo to remain
14,"What do you think are the main causes of Support for universal healthcare, and how certain are you about these relationships? Please also indicate if these influences are positive (increasing) or negative (decreasing).",The belief that everyone is deserving to basic necessities. Taking care of medical issues should not be a concern.
15,"Does Healthcare accessibility have a positive or negative effect on Support for universal healthcare, and how significant is this effect? Does it have a positive effect (increasing it) or a negative effect (decreasing it)? How strong is this effect?",I do not know
16,How confident are you that changes in Economic burden lead to changes in Support for universal healthcare? Does it have a positive effect (increasing it) or a negative effect (decreasing it)? How strong is this effect?,Very confident. If people knew or understood the actual cost of universal healthcare they could make an informed decision rather than one based on fear.
17,How confident are you that changes in Private practice as an alternative lead to changes in Support for universal healthcare? Does it have a positive effect (increasing it) or a negative effect (decreasing it)? How strong is this effect?,Possibly a positive effect so that those who do not want to buy in can be excluded and have their own providers at their own cost.
18,"Does Prioritizing general population have a positive or negative effect on Support for universal healthcare, and how significant is this effect? Does it have a positive effect (increasing it) or a negative effect (decreasing it)? How strong is this effect?",I think it would have a positive effect as prioritizing the general population would entail taking care of them. It would be a strong effect.
19,How confident are you that changes in Negative public perception lead to changes in Support for universal healthcare? Does it have a positive effect (increasing it) or a negative effect (decreasing it)? How strong is this effect?,Not sure.
20,What causes changes in Universal healthcare? Are these influences strong or weak?,I would not know. I know of countries who have universal healthcare but I do not know what leads to changes within the system.
21,"What factors affect First-world countries, and which ones have the strongest influence? Please also indicate if these influences are positive (increasing) or negative (decreasing).",Can you define what factors are to be considered?
22,"Would small changes in Fear-Based Decisions lead to noticeable changes in Support for universal healthcare, or would it take larger shifts? Does it have a positive effect (increasing it) or a negative effect (decreasing it)? How strong is this effect?",I don't know how fear-based decisions would lead to changes at all in support for universal healthcare.
23,How confident are you that changes in Positive effect lead to changes in Support for universal healthcare? Does it have a positive effect (increasing it) or a negative effect (decreasing it)? How strong is this effect?,"I think any positive change helps universal healthcare be seen in a better light, but I am not sure. Seems to be a weak effect that is almost imperceptable."