Session ID,session_1747374579717_ng3d4ti
Prolific ID,677fb35eafd357a07e351a9f
Status,completed
Progress,23/23
Created At,"5/16/2025, 1:49:39 AM"
Updated At,"5/16/2025, 2:06:08 AM"
Completed At,"5/16/2025, 2:06:08 AM"

Question Number,Question,Answer
1,To what extent do you support or oppose universal healthcare policies that provide government-funded healthcare coverage for all citizens? Please explain your reasoning.,support so that all individuals have access to basic medical care
2,"What do you think are the most significant impacts, positive or negative, of implementing a universal healthcare system?","all people will be have access to healthcare, but taxes may increase or overall care quality may decrease"
3,How do you think universal healthcare policies might affect healthcare quality and accessibility?,"quality may decrease, and wait times may increase"
4,What impact do you believe a universal healthcare system might have on medical innovation and research?,innovation and research may decrease
5,How do you think universal healthcare might affect the economic burden on individuals and families?,low income individuals may benefit from lower healthcare costs. higher income families may pay more in taxes
6,What role do you believe government should play in healthcare delivery and financing?,government should ensure all citizens have access to basic healthcare
7,How might healthcare provider concerns factor into decisions about universal healthcare implementation?,"there may be a decrease in healthcare providers, leading to shortages and longer wait times"
8,"What economic effects, both positive and negative, might result from transitioning to a universal healthcare system?",taxes may increase for some. lower income people may get help in form of less healthcare costs
9,How do you think the interests of taxpayers versus healthcare consumers should be balanced when making healthcare policy?,"healthcare consumers can find contentment with basic needs, and taxpayers can sacrifice a small amount of income"
10,What role do you think social equity and access to care play in discussions about healthcare policy?,social equity and access to care play a positive role in support of healthcare policy and universal healthcare approval
11,"Would small changes in Access to medical care lead to noticeable changes in Support for universal healthcare, or would it take larger shifts? Does it have a positive effect (increasing it) or a negative effect (decreasing it)? How strong is this effect?",it would take larger shifts to have a positive effect
12,What causes changes in Support for universal healthcare? Are these influences strong or weak?,if society sees people getting sick and dying on a large scale because of lack of health insurance there will be a strong support for universal healthcare
13,How would you describe the relationship between Increased taxes and Support for universal healthcare? Is it a strong or weak connection? Does it have a positive effect (increasing it) or a negative effect (decreasing it)? How strong is this effect?,a strong negative effect
14,How confident are you that changes in Increase in wait times lead to changes in Support for universal healthcare? Does it have a positive effect (increasing it) or a negative effect (decreasing it)? How strong is this effect?,a strong negative effect
15,"Is the effect of Decrease in innovation and research on Support for universal healthcare immediate, or does it take time to develop? Does it have a positive effect (increasing it) or a negative effect (decreasing it)? How strong is this effect?",it takes time to develop for a strong negative effect to happen
16,How confident are you that changes in Lower healthcare costs for low-income individuals lead to changes in Support for universal healthcare? Does it have a positive effect (increasing it) or a negative effect (decreasing it)? How strong is this effect?,it has a moderate positive effect I am moderately confident
17,"Would small changes in Shortages of healthcare providers lead to noticeable changes in Support for universal healthcare, or would it take larger shifts? Does it have a positive effect (increasing it) or a negative effect (decreasing it)? How strong is this effect?",it would have a small negative effect
18,"Would small changes in Lower healthcare costs for lower income people lead to noticeable changes in Support for universal healthcare, or would it take larger shifts? Does it have a positive effect (increasing it) or a negative effect (decreasing it)? How strong is this effect?",it would have a moderate positive effect
19,How would you describe the relationship between contentment of healthcare consumers and Support for universal healthcare? Is it a strong or weak connection? Does it have a positive effect (increasing it) or a negative effect (decreasing it)? How strong is this effect?,"if healthcare consumers are content with basic healthcare, there would be a moderate positive effect for support for universal healthcare"
20,"Would small changes in balance between interests lead to noticeable changes in Support for universal healthcare, or would it take larger shifts? Does it have a positive effect (increasing it) or a negative effect (decreasing it)? How strong is this effect?",it would take larger shifts for noticeable positive effects to happen
21,What causes changes in Decrease in healthcare quality? Are these influences strong or weak?,"less healthcare providers due to less financial incentives, less research and development due to less financial incentives, have a strong effect"
22,"Is the effect of Strong negative effect on Support for universal healthcare immediate, or does it take time to develop? Does it have a positive effect (increasing it) or a negative effect (decreasing it)? How strong is this effect?",it takes time for it to develop a strong negative effect
23,"Would small changes in Moderate Positive Effect lead to noticeable changes in Support for universal healthcare, or would it take larger shifts? Does it have a positive effect (increasing it) or a negative effect (decreasing it)? How strong is this effect?",it would take larger shifts to have a strong positive effect