Session ID,session_1747403396678_ehyv6ro
Prolific ID,6810e66d3f6d622de733cb42
Status,completed
Progress,33/33
Created At,"5/16/2025, 9:49:56 AM"
Updated At,"5/16/2025, 10:20:06 AM"
Completed At,"5/16/2025, 10:20:06 AM"

Question Number,Question,Answer
1,Welcome to the Trace Your Thinking interview system. This platform is designed to capture your thoughts about urban zoning and housing development. Would you like me to guide you through using this system?,"Alright, let's begin!"
2,"You have two options for answering questions: voice recording or typing. For voice recording, press the microphone button (🎤) or the Space key to start recording. When finished, press the microphone button or Space key again to stop. You can also press ESC to cancel. The system will automatically transcribe and submit your response after recording. Would you like to try voice recording now?",Noted
3,"For text input, click the message icon (💬) to switch modes. Type your response in the text box. Press Ctrl+Enter or click the send button (➤) to submit. You can press ESC to clear your text. Would you like to try text input now?",Noted
4,"You can switch between voice and text modes at any time. In voice mode, the microphone button will show as red when recording is active. During transcription, you'll see 'Transcribing your speech...' and your answer will be automatically submitted once ready. Feel comfortable with the system now?","Yes, I am comfortable."
5,"As the interview progresses, you'll notice the progress bar at the top of the screen showing your current position. Based on your responses, the system may generate follow-up questions to dive deeper into specific topics. These new questions will be added to your interview flow automatically. This helps us capture your thinking process more thoroughly.",Noted
6,Excellent! We're now ready to begin the interview about urban zoning policies. Take your time with each response and provide as much detail as you'd like. Let's start with our first question.,I am ready
7,To what extent do you support or oppose upzoning policies that allow for higher density housing in traditionally single-family neighborhoods? Please explain your reasoning.,"I somewhat support upzoning because it can help address housing shortages and affordability, though it should be balanced with thoughtful planning to preserve neighborhood infrastructure and quality of life."
8,"What do you think are the most significant impacts, positive or negative, of increasing housing density in residential neighborhoods?","The most significant impacts of increasing housing density include improved housing affordability and better use of land (positive), as well as potential strains on infrastructure, increased traffic, and changes to neighborhood character (negative)."
9,How do you think upzoning policies might affect housing affordability in urban areas?,"Upzoning policies can improve housing affordability in urban areas by increasing the supply of housing, which may help lower or stabilize prices, especially in high-demand neighborhoods though the impact may vary depending on implementation and market conditions."
10,What impact do you believe increased housing density might have on neighborhood character and quality of life?,"It may change neighborhood character and increase noise or traffic, but also bring more amenities and vibrancy."
11,How do you think upzoning might affect transportation systems and traffic congestion in cities?,Upzoning may increase traffic congestion but also support public transit use if planned well.
12,What role do you believe local government should play in regulating housing development and density?,"Local government should balance housing needs with community input, infrastructure capacity, and long-term planning."
13,How might environmental concerns factor into decisions about urban density and zoning?,"Environmental concerns can influence zoning by encouraging dense, walkable development to reduce sprawl, emissions, and habitat loss."
14,"What economic effects, both positive and negative, might result from changing zoning laws to allow more multi-family housing?",Positive effects include job creation and lower housing costs; negatives may include rising land prices and displacement risks.
15,How do you think the interests of current residents versus future residents should be balanced when making zoning decisions?,"Zoning decisions should balance current residents quality of life with the need to accommodate future residents through inclusive, forward-looking planning."
16,What role do you think social equity and access to opportunity play in discussions about zoning and housing policy?,"Social equity and access to opportunity are crucial, as zoning policies should ensure all people, regardless of income or background, can access affordable housing, good schools, and jobs."
17,How would you describe the relationship between Housing shortages and Support for Upzoning? Is it a strong or weak connection? Does it have a positive effect (increasing it) or a negative effect (decreasing it)? How strong is this effect?,"The relationship between housing shortages and support for upzoning is strong and positive greater housing shortages tend to increase support for upzoning, as people see it as a solution to boost supply and improve affordability."
18,"What might lead to increases or decreases in Support for Upzoning, and how significant are these effects? Please also indicate if these influences are positive (increasing) or negative (decreasing).","Increases in support for upzoning can come from rising housing costs and shortages, while decreases may result from concerns about neighborhood change, traffic, or overcrowded schools, both effects can be significant depending on local context and community engagement."
19,How confident are you that changes in Increase in housing supply lead to changes in Support for Upzoning? Does it have a positive effect (increasing it) or a negative effect (decreasing it)? How strong is this effect?,"I am confident that increases in housing supply have a positive effect on support for upzoning, and this effect is moderately strong because more supply can ease shortages and improve affordability."
20,How confident are you that changes in Neighborhood character lead to changes in Support for Upzoning? Does it have a positive effect (increasing it) or a negative effect (decreasing it)? How strong is this effect?,"I am confident that changes in neighborhood character have a negative effect on support for upzoning, and this effect is fairly strong because many residents worry about losing the feel and identity of their community."
21,How would you describe the relationship between Traffic congestion and Support for Upzoning? Is it a strong or weak connection? Does it have a positive effect (increasing it) or a negative effect (decreasing it)? How strong is this effect?,"The relationship between traffic congestion and support for upzoning is moderate and negative, increased congestion tends to decrease support because it raises concerns about overcrowding and commute times."
22,How confident are you that changes in Community input lead to changes in Support for Upzoning? Does it have a positive effect (increasing it) or a negative effect (decreasing it)? How strong is this effect?,"I am confident that increased community input has a positive effect on support for upzoning, and this effect is moderately strong because when people feel heard, they’re more likely to accept changes."
23,"Does Urban density have a positive or negative effect on Support for Upzoning, and how significant is this effect? Does it have a positive effect (increasing it) or a negative effect (decreasing it)? How strong is this effect?","Urban density generally has a positive effect on support for upzoning, and this effect is moderate to strong because denser areas often recognize the need for more housing and infrastructure improvements."
24,"Would small changes in Lower housing costs lead to noticeable changes in Support for Upzoning, or would it take larger shifts? Does it have a positive effect (increasing it) or a negative effect (decreasing it)? How strong is this effect?","It would take larger shifts in lower housing costs to noticeably increase support for upzoning; the effect is positive but generally moderate, as small changes may not immediately change opinions."
25,How confident are you that changes in Accommodating future residents lead to changes in Support for Upzoning? Does it have a positive effect (increasing it) or a negative effect (decreasing it)? How strong is this effect?,I am confident that efforts to accommodate future residents have a positive and moderately strong effect on support for upzoning because planning for growth helps communities see the long-term benefits.
26,"Is the effect of Access to opportunity on Support for Upzoning immediate, or does it take time to develop? Does it have a positive effect (increasing it) or a negative effect (decreasing it)? How strong is this effect?","The effect of access to opportunity on support for upzoning usually takes time to develop, has a positive effect, and is moderately strong as people gradually recognize the benefits of equitable housing access."
27,What causes changes in Upzoning policies? Are these influences strong or weak?,"Changes in upzoning policies are caused by housing demand, political will, community input, and economic factors; these influences can be strong or weak depending on local priorities and pressures."
28,"Does Improve affordability have a positive or negative effect on Support for Upzoning, and how significant is this effect? Does it have a positive effect (increasing it) or a negative effect (decreasing it)? How strong is this effect?",Improving affordability has a strong positive effect on support for upzoning because it directly addresses housing needs and gains community backing.
29,"Does Negative effect have a positive or negative effect on Support for Upzoning, and how significant is this effect? Does it have a positive effect (increasing it) or a negative effect (decreasing it)? How strong is this effect?","A negative effect decreases support for upzoning and can be quite strong, especially when concerns involve neighborhood character, traffic, or overcrowded schools."
30,"Would small changes in Positive effect lead to noticeable changes in Support for Upzoning, or would it take larger shifts? Does it have a positive effect (increasing it) or a negative effect (decreasing it)? How strong is this effect?","Small changes in positive effects may lead to some increase in support for upzoning, but larger shifts are usually needed for noticeable impact; overall, the effect is positive and moderate in strength."
31,"Does Moderately strong effect have a positive or negative effect on Support for Upzoning, and how significant is this effect? Does it have a positive effect (increasing it) or a negative effect (decreasing it)? How strong is this effect?","A moderately strong effect can be either positive or negative on support for upzoning, meaning it significantly increases or decreases support depending on the influence, but the strength is consistently noticeable."
32,"What factors do you think influence Increased housing density, and how strong is their impact? Please also indicate if these influences are positive (increasing) or negative (decreasing).","Factors influencing increased housing density include housing demand (positive, strong), zoning laws (positive, strong), community opposition (negative, moderate), infrastructure capacity (negative, moderate), and economic incentives (positive, moderate)."
33,"What do you think are the main causes of Upzoning, and how certain are you about these relationships? Please also indicate if these influences are positive (increasing) or negative (decreasing).","The main causes of upzoning are housing shortages (positive, strong), political support (positive, moderate), community advocacy (positive, moderate), and concerns about neighborhood impact (negative, moderate); I am fairly confident in these relationships."