Session ID,session_1747385252922_8sce9xv
Prolific ID,681bdc1e16b44acc6f14c3b6
Status,completed
Progress,32/32
Created At,"5/16/2025, 4:47:32 AM"
Updated At,"5/16/2025, 5:05:16 AM"
Completed At,"5/16/2025, 5:05:16 AM"

Question Number,Question,Answer
1,Welcome to the Trace Your Thinking interview system. This platform is designed to capture your thoughts about urban zoning and housing development. Would you like me to guide you through using this system?,Okay. 
2,"You have two options for answering questions: voice recording or typing. For voice recording, press the microphone button (🎤) or the Space key to start recording. When finished, press the microphone button or Space key again to stop. You can also press ESC to cancel. The system will automatically transcribe and submit your response after recording. Would you like to try voice recording now?","Yes, let's proceed."
3,"For text input, click the message icon (💬) to switch modes. Type your response in the text box. Press Ctrl+Enter or click the send button (➤) to submit. You can press ESC to clear your text. Would you like to try text input now?",I still not it. Not it. It's possible.
4,"You can switch between voice and text modes at any time. In voice mode, the microphone button will show as red when recording is active. During transcription, you'll see 'Transcribing your speech...' and your answer will be automatically submitted once ready. Feel comfortable with the system now?",Okay.
5,"As the interview progresses, you'll notice the progress bar at the top of the screen showing your current position. Based on your responses, the system may generate follow-up questions to dive deeper into specific topics. These new questions will be added to your interview flow automatically. This helps us capture your thinking process more thoroughly.",Noted.
6,Excellent! We're now ready to begin the interview about urban zoning policies. Take your time with each response and provide as much detail as you'd like. Let's start with our first question.,OK.
7,To what extent do you support or oppose upzoning policies that allow for higher density housing in traditionally single-family neighborhoods? Please explain your reasoning.,"I support it greatly because it creates room for cheaper housing, giving other people opportunities to have houses. It also eases the pressure on the housing and support the businesses, local businesses thrive because of the traffic."
8,"What do you think are the most significant impacts, positive or negative, of increasing housing density in residential neighborhoods?","And part of the positive is definitely traffic means business. So there are lots of businesses in there. There'll be lots of local businesses routing within their locality, because there'll be a lot of people living around. And two, I would say, on the other negative, which is not really a major factor right now, the higher traffic might bring in the human and the car traffic, and a couple of a few criminal activities."
9,How do you think upzoning policies might affect housing affordability in urban areas?,it will affect it to the positive a great deal because the houses will be affordable.
10,What impact do you believe increased housing density might have on neighborhood character and quality of life?,"There will be cross-mixing, cross-matching, because definitely there will be bad people coming around. But again, the positive of it is that there will be other good people coming around. The increased traffic will bring in more infrastructure, more businesses, more schools into the area."
11,How do you think upzoning might affect transportation systems and traffic congestion in cities?,"There will be a lot of traffic, congestion, because the already available traffic system only factored in the current system, but now up, up, up, zoning would mean that there'll be more people, there'll be a lot of pressure on the traffic."
12,What role do you believe local government should play in regulating housing development and density?,"They should by increasing more infrastructure, factoring in the pressure and coming up with policies and regulations."
13,How might environmental concerns factor into decisions about urban density and zoning?,"Yes, environmental concerns are factors, and that's anytime a building is coming up or zoning is happening, they have to factor in the environmental impacts, so that it doesn't negatively impact our environment."
14,"What economic effects, both positive and negative, might result from changing zoning laws to allow more multi-family housing?","The positive is that the pressure, the congestion, the people coming around will boost the economic activities in the region. There will be a lot of business sprouting. So it's on the positive, yes."
15,How do you think the interests of current residents versus future residents should be balanced when making zoning decisions?,"should strike a balance in that they need to be made aware of why that has to happen, that the interest they are catered for, the status quo, nothing changes, they still maintain the status and the services. At the same time, those coming in must also be elevated to that level and be given the systems of that zone."
16,What role do you think social equity and access to opportunity play in discussions about zoning and housing policy?,We are all entitled to show liquidity and opportunity and access to basic needs.
17,"Does Cheaper housing have a positive or negative effect on Support for Upzoning, and how significant is this effect? Does it have a positive effect (increasing it) or a negative effect (decreasing it)? How strong is this effect?","It's just the positive, both positive and negative. The positive is that, as I mentioned earlier, it brings in more economic activity to the region and lots of business will sprout. But the negative is that it might negatively impact the environment in a way, and also at the same time might bring in a few criminal activities within the zone."
18,"What factors do you think influence Support for Upzoning, and how strong is their impact? Please also indicate if these influences are positive (increasing) or negative (decreasing).",Access to basic needs and having affordable housing within the state is a factor to upgrade the living standards of everybody because we are all entitled to a fair and better lifestyle.
19,How confident are you that changes in Traffic increase lead to changes in Support for Upzoning? Does it have a positive effect (increasing it) or a negative effect (decreasing it)? How strong is this effect?,"Yes, it has positive effect in that the traffic increase will be on the support for upzoning and the traffic increase will bring positive economic activities within the zone."
20,"Does Housing affordability have a positive or negative effect on Support for Upzoning, and how significant is this effect? Does it have a positive effect (increasing it) or a negative effect (decreasing it)? How strong is this effect?","Yes, a great deal. Housing affordability is a major factor in influencing where one lives and in one's lifestyle because it affects the disposable income."
21,"Does Increased traffic have a positive or negative effect on Support for Upzoning, and how significant is this effect? Does it have a positive effect (increasing it) or a negative effect (decreasing it)? How strong is this effect?","Positive, in that I'm creating more demand and opportunities."
22,"Does Presence of bad people have a positive or negative effect on Support for Upzoning, and how significant is this effect? Does it have a positive effect (increasing it) or a negative effect (decreasing it)? How strong is this effect?","negative. It scares away many people and yes, not so many people want to associate with the region."
23,"Would small changes in Traffic Congestion lead to noticeable changes in Support for Upzoning, or would it take larger shifts? Does it have a positive effect (increasing it) or a negative effect (decreasing it)? How strong is this effect?",So the positive changes on the traffic congestion are manageable and also accessibility and also working systems.
24,How would you describe the relationship between Increased Population Density and Support for Upzoning? Is it a strong or weak connection? Does it have a positive effect (increasing it) or a negative effect (decreasing it)? How strong is this effect?,"There's a very strong connection between increased population density and support for upzoning because yes, we are growing every single day and we need to accommodate everyone, everyone needs to be accommodated. So I'm positively supporting it and it should be, it will bring a great positive change."
25,How would you describe the relationship between Infrastructure development and Support for Upzoning? Is it a strong or weak connection? Does it have a positive effect (increasing it) or a negative effect (decreasing it)? How strong is this effect?,"some connection between the infrastructure and support for upzoning. Thus, there has to be strong infrastructure development to support the already increased population."
26,"Would small changes in Zoning lead to noticeable changes in Support for Upzoning, or would it take larger shifts? Does it have a positive effect (increasing it) or a negative effect (decreasing it)? How strong is this effect?","Yes, every effort counts, however small, and everything that is positive will definitely bring positive effects into the design."
27,How would you describe the relationship between Environmental Impacts and Support for Upzoning? Is it a strong or weak connection? Does it have a positive effect (increasing it) or a negative effect (decreasing it)? How strong is this effect?,There's a strong connection because their process must factor in the environmental impact because the environmental actors must positively and aggressively support and protect our environment.
28,How confident are you that changes in Economic activity increase lead to changes in Support for Upzoning? Does it have a positive effect (increasing it) or a negative effect (decreasing it)? How strong is this effect?,"And we'll start with that, with the positive changes in economic activity in an area that increases, it's definitely more money, more cash flows around, and there'll be lots of economic sprouts."
29,How confident are you that changes in Current Residents lead to changes in Support for Upzoning? Does it have a positive effect (increasing it) or a negative effect (decreasing it)? How strong is this effect?,"Yes, I'm very confident that it will lead to positive, but again, I say that people will, so it's both positive and negative, but on the positive more, because more people will move, we need to upscale, to upzone, but there are a few people who will be, would not feel comfortable now to move now to that, to which is also still positive, but they'll move to higher, higher zones."
30,"Would small changes in Zoning Decisions lead to noticeable changes in Support for Upzoning, or would it take larger shifts? Does it have a positive effect (increasing it) or a negative effect (decreasing it)? How strong is this effect?","The decisions made in terms of controlling traffic, controlling businesses, controlling what's coming up, controlling the environment, being a factor in the environment, will definitely be positive, both positive and negative, depending on what decision has been made."
31,How confident are you that changes in Access to Opportunity lead to changes in Support for Upzoning? Does it have a positive effect (increasing it) or a negative effect (decreasing it)? How strong is this effect?,100% I strongly agree about it because when there's access lots of opportunities definitely room for up-zoning because it attracts so many people there'll be traffic there'll be availability of accessible labor and resources and ready market.
32,"What factors affect Upzoning policies, and which ones have the strongest influence? Please also indicate if these influences are positive (increasing) or negative (decreasing).","infrastructure development, environmental impact, economic activities."